,Unnamed: 0,text,sarcasm
1025,1025.0,Yeah?,0.0
1026,1026.0,Oh tons. I am quite the woodsman.,1.0
1027,1027.0,Uh-huh!,0.0
1028,1028.0,Yes it is.,0.0
1029,1029.0,"Well, I'm a headhunter. I hook up out of work Soviet scientists with rogue third-world nations. Hi Rasputin!",1.0
1030,1030.0,"Yes and we are ""very"" excited about it.",1.0
1031,1031.0,"Y'know what I mean, like dubbies?",0.0
1032,1032.0,"Ah well, this is the living room.",0.0
1033,1033.0,We thought you were just here for the company. He is a sarcasmoholic Stewart.,1.0
1034,1034.0,You're gonna have to tell me how you did that.,0.0
1035,1035.0,"Uh, I'm gonna kill myself!",0.0
1036,1036.0,"Yeah well that's because uh .. I stayed in my room. Yeah, you don't want to look in my hamper.",0.0
1037,1037.0,"The Jamestown colony of Virginia. You see King George is giving us the land, so.",1.0
1038,1038.0,"Oh, come on!",0.0
1039,1039.0,"So, I'm sorry I just don't think we should go away together yet.",0.0
1040,1040.0,What a baby.,0.0
1041,1041.0,What did you want to show us? Because all I can see is this bitchin van,0.0
1042,1042.0,"That's easy for you to say, you weren't almost just killed.",1.0
1043,1043.0,Okay?,0.0
1044,1044.0,Oh yeah right. And what would my opening line be? Excuse me,1.0
1045,1045.0,"Uh, Rachel's here, so good luck man, let me know how it works out.",1.0
1046,1046.0,"Oh sure, she was probably up all night excited about the party she knows is happening.",1.0
1047,1047.0,"Okay, now much have you won so far?",0.0
1048,1048.0,"Almost! But first, we gotta start.",1.0
1049,1049.0,Really?,0.0
1050,1050.0,"Oh hey, great, you're up. Rachel, this is my sister Krista. Krista, this is Rachel.",0.0
1051,1051.0,All right I'll have one.,1.0
1052,1052.0,DANGER,0.0
1053,1053.0,"No just, nobody press on my stomach.",0.0
1054,1054.0,Hey! It's starting to snow.,0.0
1055,1055.0,"Joey if I go first, I want to be looking for my keys",1.0
1056,1056.0,"Oh my God, wh-what happened?",0.0
1057,1057.0,I can see it from right here. It'll cost you one husband.,1.0
1058,1058.0,What?!?!,0.0
1059,1059.0,"Uh-huh, well! But umm, still I'm-I'm mad at you.",0.0
1060,1060.0,So now I have to go so he'll think that I'm totally ok with seeing him!,1.0
1061,1061.0,"Look now, Phoebe remember, hey, their just fulfilling their Christmas....",0.0
1062,1062.0,"And, uh, I don't know if you got any of that, but I would really like a copy of the tape.",0.0
1063,1063.0,"Well yes Ross, pressing my third nipple opens the delivery entrance to the magical land of Narnia.",1.0
1064,1064.0,Chandler?,0.0
1065,1065.0,"Oh my god, where are all the men?",0.0
1066,1066.0,No! I'm so happy for them!,0.0
1067,1067.0,"Oh I see, I thought you just really really liked your new couch.",1.0
1068,1068.0,You can't do anything.,0.0
1069,1069.0,Why? Because she can sing and play guitar and do both at the same time?,1.0
1070,1070.0,And then for forgetting to invite you to it.,0.0
1071,1071.0,"On the other hand in um, in about seven months you're gonna have something that you're gonna love more than any guy you've ever gone out with.",0.0
1072,1072.0,No!,0.0
1073,1073.0,Why?,0.0
1074,1074.0,"We were wondering what was taking so long with the gift, but now we understand you were doing this.",1.0
1075,1075.0,And the bunny got away!,1.0
1076,1076.0,"You and I, we're interfacing.",0.0
1077,1077.0,"See now that I see crying over, but Bambi, is a cartoon.",1.0
1078,1078.0,"Oh yes Blanche, about a half hour ago. But now I have hidden her again so you can find her.",1.0
1079,1079.0,I talk to you and nothin'.,0.0
1080,1080.0,Well why don't you check in one of my saddle bags while I chew on a bale of hay.,1.0
1081,1081.0,"Yeah, I don't think so Joe.",0.0
1082,1082.0,"How about stopping by new years eve with three naked women, throwing up in the pool, passing out in the punch bowl, and relieving yourself in the linen closet?",0.0
1083,1083.0,I can't believe it.  Can I tell you something? I'm a little mad at him now.,0.0
1084,1084.0,I'd miss you if I broke up with you. Just trying to be supportive.,0.0
1085,1085.0,Noooo. Really?,1.0
1086,1086.0,"Our balcony? Seriously? That's so funny because I told Monica we should put lights on our balcony. - And she said - ""No no, its too cold, nobody will go out there.""  - I said ""Maybe if we put some lights out there they will"".",1.0
1087,1087.0,No I am upset because crocodin turbs are wearing darker colors.,1.0
1088,1088.0,No way!,0.0
1089,1089.0,"No Rose, I am developing pictures from the magellan space probe",1.0
1090,1090.0,Hey.,0.0
1091,1091.0,"You are right, by saying nice, I am virtually licking her.",1.0
1092,1092.0,I just called a friend of mine.,0.0
1093,1093.0,Just tell me how.,1.0
1094,1094.0,"I don't know Rose, maybe Marry Poppins has an Italian cousin.",1.0
1095,1095.0,"Hi, Joey. Well well, look what you brought. Very nice.",0.0
1096,1096.0,And protected them from a tornado?,1.0
1097,1097.0,"Pheebs, you may know this, you know strange things. What is the boiling point of brain?",1.0
1098,1098.0,What do you know? Its a treat for the eyes and the ears.,1.0
1099,1099.0,"Cause all I ever get to do now is pregnant stuff, it just bums me out.",0.0
1100,1100.0,"Whoa, whoa, whoa.",0.0
1101,1101.0,It's my friends.,0.0
1102,1102.0,"Nice jon Joe, you are quite the craftsman!",1.0
1103,1103.0,Cover yourself up!,0.0
1104,1104.0,I've never loved anybody as much as I love you.,0.0
1105,1105.0,"ThatÃ•s good, just keep rubbing your head. That will turn back time",1.0
1106,1106.0,Oh well. It probably would've been the most constructive solution.,0.0
1107,1107.0,"Oh my god, you almost gave me a heart attack!",1.0
1108,1108.0,Show them your slides of Hawaii,1.0
1109,1109.0,"Umm, excuse me, we switched apartments. You can't eat are food anymore, that-that gravy train had ended.",0.0
1110,1110.0,"I didn't know you and Carol were getting divorced, I'm sorry.",0.0
1111,1111.0,"I'm just gonna throw it out, it's probably just a bunch of shampoo and...",0.0
1112,1112.0,"It's white plastic, with a handle, and it fits onto a stroller.",0.0
1113,1113.0,"If that doesn't keep kids in school, what will?",1.0
1114,1114.0,"Great! Okay, here.",0.0
1115,1115.0,Yeah it would!,0.0
1116,1116.0,Oh.,0.0
1117,1117.0,On the home shopping network,1.0
1118,1118.0,"No Rose, go to the corner and open a stand",1.0
1119,1119.0,"Alright, I'm gonna go pick up a few things for the trip.",0.0
1120,1120.0,"No, no, I am just looking for a man to draw on me with chalk.",1.0
1121,1121.0,"Can't do it, can you?",0.0
1122,1122.0,I don't think so. Hello?  When you get in there,0.0
1123,1123.0,It would be nice to have a little guarantee though.,1.0
1124,1124.0,"Hey, did you hear what Peter Gregory is doing?",0.0
1125,1125.0,"Oh. Look at me, I traveled back to 2009.",1.0
1126,1126.0,It's an upside down cross.,0.0
1127,1127.0,To his beneficence.,0.0
1128,1128.0,Hey. Sorry if I scared you. I know I have somewhat ghost-like features.,0.0
1129,1129.0,"Listen, we all love Big Head. But the truth is, he's not as good of a coder as I am, not as good at system architecture as Gilfoyle, not as good at being a prick as you, no offense.",1.0
1130,1130.0,I was sleeping. I'm sorry for sleeping and for lying about it.,0.0
1131,1131.0,Like Jesus over Satan.,0.0
1132,1132.0,Is it a margarita machine?,0.0
1133,1133.0,"""Placeholder"" would honestly be a better name than Pied Piper.",1.0
1134,1134.0,Your borders are merely a construct. I prefer to think of myself as a citizen of the world.,1.0
1135,1135.0,"We might as well have interns, we hire illegal aliens.",1.0
1136,1136.0,Hey! That is not Cherry Garcia.,0.0
1137,1137.0,He ate the whole bag of gold caps. Awesome!,0.0
1138,1138.0,"Oh, yeah. No, she's... She's very pretty.",0.0
1139,1139.0,You catch on slow. You'll fit right in here.,1.0
1140,1140.0,"For which I forewent, yes, that's a real word, one million dollars.",0.0
1141,1141.0,"is a perfect example of you having no vision, no balls and no game. Maybe he did blow him. Well, love and hate. It's all passion.",0.0
1142,1142.0,"Anything to do with ""error"" sounds like your whole vibe.",1.0
1143,1143.0,Maybe my leisurely pace is just a little faster than yours.,1.0
1144,1144.0,"Take your time. There's no rush, Dinesh.",1.0
1145,1145.0,"Yes, we are totally fucked.",0.0
1146,1146.0,She's attracted to ugliness.,1.0
1147,1147.0,At least it didn't happen in a public and brutally embarrassing way.,1.0
1148,1148.0,"I get it. You hear the word ""chief,"" and you think ""Indian Chief."" but you're the other kind of Indian.",1.0
1149,1149.0,"Richard, tell him I'm CTO. Dinesh: You already told that fat guy that I'm the CTO.",0.0
1150,1150.0,Oh. Wow. Thanks for the compliment.,1.0
1151,1151.0,But the fact that you're so sorry makes it all better.,1.0
1152,1152.0,Do you want me to be honest or nice?,1.0
1153,1153.0,Are you out of your mind?,0.0
1154,1154.0,Sounds like ERLICH.,1.0
1155,1155.0,Because we're negotiating against each other.,0.0
1156,1156.0,Does it mean taking a stack of cash and lighting it on fire?,1.0
1157,1157.0,"I disagree, OJ. We should hire the best person for the job, period.",0.0
1158,1158.0,"No, we all have equalized pay, remember?",0.0
1159,1159.0,We build our own servers.,0.0
1160,1160.0,"I'm sure you were great at fingerpainting, also, Dinesh.",1.0
1161,1161.0,"I'm not getting high on the job. I'm getting high at home. I live here, remember?",0.0
1162,1162.0,That's very comforting.,1.0
1163,1163.0,"Sorry, I couldn't remember your mother's name.",1.0
1164,1164.0,No.,0.0
1165,1165.0,That's a bold statement.,0.0
1166,1166.0,"(SIGHS) Great timing, guys. Thank you so much. Premium stuff, Dinesh.",1.0
1167,1167.0,"Gilfoyle: Yeah, compared to the shit shack we're used to, anything's an improvement.",0.0
1168,1168.0,"Don't you guys call it ""Rock, Rock, Rock""?",1.0
1169,1169.0,I can't believe you suggested the idea of building a fucking appliance.,0.0
1170,1170.0,"The more meetings I turn down, the more these recruiters send me.",0.0
1171,1171.0,"But instead of that, you bought a chain?",1.0
1172,1172.0,"Richard, look, I'm sorry, but I think the box is here to stay.",0.0
1173,1173.0,This plan better fucking work with a sacrifice like this.,0.0
1174,1174.0,"Thank you, Jared.",0.0
1175,1175.0,"But since your failure as a leader is a virtual certainty, tolerating your short reign as CEO in exchange for a front-row seat to the disaster seems fair.",1.0
1176,1176.0,"No, I think you should use more.",1.0
1177,1177.0,"I mean, I knew Dinesh was going to fuck this all up, but honestly, this couldn't get any better.",1.0
1178,1178.0,These are from your mom.,1.0
1179,1179.0,When you have to apologise,1.0
1180,1180.0,That was the Iranian Revolutionary Guard.,0.0
1181,1181.0,Your fourth child?,0.0
1182,1182.0,"So, you're not mad at me anymore?",0.0
1183,1183.0,Does it look like I care?,0.0
1184,1184.0,Now I can give it to ERLICH.,1.0
1185,1185.0,Outstanding.,1.0
1186,1186.0,"He was oddly tall, don't you think?",0.0
1187,1187.0,Congratulations. You've finally taken your rightful spot amongst the handicapped.,1.0
1188,1188.0,There better not be a Chinaman in my bed.,0.0
1189,1189.0,So do you mind telling us when you feel like you can make it in?,0.0
1190,1190.0,I'm worried about robots.,0.0
1191,1191.0,I believe we all know who's the better coder anyway.,0.0
1192,1192.0,He's our most profitable developer by far.,0.0
1193,1193.0,-Almost a human.,1.0
1194,1194.0,Do you need the real me for this conversation?,1.0
1195,1195.0,"You're new here, so I'll forgive the patronizing tone.",0.0
1196,1196.0,"I finished Cryptonomicon,",0.0
1197,1197.0,"Look, we cannot take blood money.",0.0
1198,1198.0,The-the same way we can buy America and everything in it.,1.0
1199,1199.0,"Well, maybe some time when you're working on something, I can come interrupt your flow and use words incorrectly to tell you about it.",1.0
1200,1200.0,I thought that was the company policy-these days.,1.0
1201,1201.0,That you're an alcoholic?,1.0
1202,,"And from these few months, how long have you been a demented sexual pervert?",0.0
1203,,"So, why do you think that's it?",0.0
1204,,"What else? Selling on eBay as ""slightly used.""",0.0
1205,,"And if the moment feels good, see if you can do it.",1.0
1206,,"Now that I've abandoned string theory, I'm having trouble finding my next area of interest.",0.0
1207,,"You know, if you're really serious about this, I've heard there are exciting opportunities in home care for old and fat people.",1.0
1208,,And if it turns out you and I wouldn't... you and I could live together.,1.0
1209,,"And while we're there, why not get engaged too? Why not have a small house, start a family? Enjoy our years of sunset together? Do you get along, woman?!",1.0
1210,,I'm just injecting that it's a couch because the evidence suggests that the coffee table has a small garage sale.,1.0
1211,,You'd never hear him talk like that to Sauvignon Blanc.,1.0
1212,,"I'm with him three years, nothing, she's with two minutes, and he takes off his pants.",0.0
1213,,I'll give you a plan right away. Step one: open comic book store. Step two: start saying that this comic book shop gives you genital warts.,0.0
1214,,"On the bright side, this Oxford study was right, a friend down, I wonder who you're gonna lose next.",1.0
1215,,That's how I care about buying a comic book shop.,0.0
1216,,"Look, Emily, what happened between me and Raj was a long time ago.",0.0
1217,,"It's true, you're both beautiful, you're saying something about the man who could sleep you both.",0.0
1218,,I don't need a reason... this is my house.,0.0
1219,,"When you met Bernadette, the field of robotics really took a hit.",1.0
1220,,Maybe it's a good thing we came here.,1.0
1221,,"Like all of us, get out of a car without underwear.",1.0
1222,,"Because no one wants to see Neil deGrasse Tyson in a wet T-shirt, folded on the hood of a Porsche.",0.0
1223,,"Wow, he really went where no man's been before.",0.0
1224,,"Maybe he's a mole, but in any case, it's pretty cool.",0.0
1225,,"Apparently, someone was very flirting by not wearing his engagement ring, which led someone to come here thinking that the first someone might be available.",1.0
1226,,I assumed he was in the corner of a barn somewhere.,1.0
1227,,"Next time I'm in a hurry, it's good to have some at the bank.",0.0
1228,,"I'm listening to you snoring, I wonder how I'll sleep without it.",1.0
1229,,"There's probably a new one, finish your breakfast, there's a whole section of my dashboard that doesn't have syrup on it.",0.0
1230,,"And here I am in the trap, you keep talking, I'm gonna rip my leg out.",1.0
1231,,"And I love that I work and clean up, and you're okay with that.",1.0
1232,,"You always risk getting infected, a blood clot, the possibility that an incompetent surgeon will let a spider lay eggs in your nose.",0.0
1233,,"I love that you're proud of your look, even when I have to pee in the morning, and you spend an hour on your hair.",1.0
1234,,"So, as they say, all good things must end.",0.0
1235,,Professor Abbott's family don't want it?,0.0
1236,,I suppose the sad truth is that not everyone will accomplish something great. Some of us may just have to find meaning in the small moments that make up life.,0.0
1237,,"It was almost on the subject, I'll say, ""Good work, Sheldon.""",1.0
1238,,Are you sure an idiot like me can handle something as complicated as a blanket?,1.0
1239,,"No, you're right, we should do what you're doing, that our mother sends us Walmart pants to Houston.",1.0
1240,,"Notify the editors of Oxford English Dictionary. The word ""plenty"" has been redefined to mean ""two"".",1.0
1241,,Is that why you had to take her to Office Depot last night?,0.0
1242,,"As you may know, I experienced high levels of anxiety, and I thought, what better way to increase my discomfort than to submit to a tasteless crotch conversation evening?",0.0
1243,,"And how hard is it to do when she's swollen, squeaky and cramped?",0.0
1244,,"I, uh, created other user accounts to be able to post positive comments on their paper.",0.0
1245,,The answer is in this puzzle box. Let's see if you can open it.,1.0
1246,,"No, Stuart chose these pillows to throw on his own.",1.0
1247,,"Not much, but he seemed to be in a good place.",0.0
1248,,"I don't know, maybe someone took him out of the carousel by mistake?",0.0
1249,,That's why I'm saying we should keep the champagne on ice.,1.0
1250,,The only way for her to contribute to science would be to resume sending chimpanzees into space.,1.0
1251,,"Yeah, it turns out that half a dozen menorahs really give a good mood.",1.0
1252,,"Yeah, we just want to have the kind of dinner we've all had here so many times before.",0.0
1253,,"I'm sorry, I'm not going back to the Renaissance fair.",0.0
1254,,"Yeah, that's a nice little idea. I'd like to talk to my uncle in Chicago.",1.0
1255,,That's why my people wandered through the desert for 40 years.,1.0
1256,,"And if I had a friend, they could have told me.",0.0
1257,,"So shut up, you're here for a grumpy night.",0.0
1258,,Put it in your mouth and put it like a zit.,0.0
1259,,"As soon as she enters California's airspace, I will feel a disturbance in the Force.",1.0
1260,,"I heard Bernadette tell Howard she's making him a meat loaf, and you don't have to ask me twice.",0.0
1261,,"Oh, yes, we have the moon and trees and... Elizabeth McNulty, who apparently died when she was the same age as me.",0.0
1262,,"Wow, there's a Denny in Vegas where you can get married.",0.0
1263,,Like everyone at the table.,0.0
1264,,"If I want a new pen, I have to go to the bank with wire cutters.",1.0
1265,,"Maybe when I publish it, I'll add an inhaler.",1.0
1266,,"I don't know, he just died, I've got a lot of static stuff.",0.0
1267,,"Unfortunately, Mrs. Giselle Wolowitz is sensitive to chlorine.",1.0
1268,,The most important thing is that no one touches the food on my plate.,0.0
1269,,On a dusty highway outside Bakersfield.,1.0
1270,,Maybe they can carpool when they visit you in federal jail.,1.0
1271,,"Sheldon, if you were a robot, I knew it and you didn't...",0.0
1272,,"I discreetly slipped out of the other earring, put it in my pocket and I got out of there!",0.0
1273,,The blunt instrument that will be at the center of my murder trial?,1.0
1274,,Would it work if I hit you in the face?,0.0
1275,,Answering the question once and for all why Wolowitz came out of medical school.,0.0
1276,,"You were right, your larynx is terribly inflamed, I've never seen anything like it.",1.0
1277,,"If you compile a CD for a double suicide, I hope it's for you.",1.0
1278,,"""Dave."" Looks like Leonard's got a new BFF.",1.0
1279,,"If you don't like this thing, let's go next door and build him a bear.",1.0
1280,,- Maybe I didn't hear you.,1.0
1281,,"No, the dark patterns growing under your arms hide it well.",1.0
1282,,Lie down on the floor and swim over there.,1.0
1283,,I hope to be a waitress at the Cheesecake plant for my whole life.,1.0
1284,,"When I didn't pay my bill, the Ministry of Water and Energy thought I'd appreciate the atmosphere.",1.0
1285,,Tell them more about their secret love for each other.,0.0
1286,,"It makes you feel more alive, doesn't it?",1.0
1287,,"What a chance for you that the university ""has chosen to hire you, despite the fact that you have not done an original research in 25 years, and rather wrote a series of popular books ""that reduce the great concepts of science"" to a series of anecdotes, ""everyone has had fun to accommodate the duration ""of an average intestinal movement.",1.0
1288,,"Assuming I can keep up with that, three hours, 11 minutes, plus how long it takes to finish this rather useless conversation.",1.0
1289,,"Excuse me, but what about me?",0.0
1290,,"Do cocaine smugglers write ""cocaine"" on the box?",1.0
1291,,You know it can go on all night.,0.0
1292,,Hope he's already read and familiar with the recovery of the multiverse DC.,0.0
1293,,"You think ""coffee"" is coffee, it's so cute.",1.0
1294,,"You don't really believe in this superstition, do you?",0.0
1295,,"What if I change my name and live with my cousin and her husband, Avi, in Israel?",1.0
1296,,Barely a day passes when I don't think about it.,1.0
1297,,"Of course, maybe a picture of me trying to suck you to death.",1.0
1298,,"Great, it's just... I don't think Penny wants me to go.",0.0
1299,,What did you mean when you said you'd miss me?,0.0
1300,,My parents thought that naming me Leonard and putting me in advanced placement didn't make me beat enough.,1.0
1301,,"Oh, a big conversation about a man who was ripped off by a chicken.",1.0
1302,,"No, I mean, we can always come back to being friends.",0.0
1303,,"It's an iCal download, she can put it in her phone.",1.0
1304,,"You know, I always wanted to go to a Goth nightclub.",1.0
1305,,"No, I'm late for reading Wiki.",0.0
1306,,- I don't want chocolate!,0.0
1307,,"Oh, you know, Goth stuff, Goth magazines, Goth music.",0.0
1308,,"Obviously, the waitress at Cheese Cake Factory is a complex socio-economic activity that requires a lot of analysis and planning.",1.0
1309,,When I get enough to destroy all the human toasts on the Battlestar known as Galactica.,1.0
1310,,Looks like there's a lot of trouble having sex.,0.0
1311,,"But if she throws you away, she'll have a new boyfriend by tomorrow morning and you'll have a new girlfriend when you figure out how to build one.",1.0
1312,,"Not a big movie, but watch this beautiful desert.",0.0
1313,,"It was so good, sweet and fleshy at the same time.",0.0
1314,,"I'm sorry, playing with you in the bathtub is a real class number.",1.0
1315,,"No, I mean Princess Leia, of course Bernadette, she's a wonderful girl and she loves you very much.",1.0
1316,,"And while we're at it, why don't you put your hands behind your back, have an old-fashioned food contest?",1.0
1317,,Leonard's work is almost as amazing as third-year students who grow lima grains in wet paper towels.,1.0
1318,,"Okay, I have a bone to choose with you.",0.0
1319,,"Raj, you should have seen Leonard's experience.",0.0
1320,,"I was going to ask Leonard to do it, but he seemed a little emotionally unstable and you don't want someone like him to operate heavy machines.",0.0
1321,,"Of course, cut the stranger in half, there's a billion more where he comes from.",1.0
1322,,"We don't need to talk about it anymore, Leonard covered it pretty well in the car.",1.0
1323,,Don't you think looking for a new city where to live is a little exaggerated?,0.0
1324,,"I understand your point of view, but with a choice, Jews always go with Chinese food.",1.0
1325,,"Well, I always thought it was to study us, discover our weaknesses, and report to your alien lords.",1.0
1326,,Why don't you keep these things in the bathroom?,0.0
1327,,"Oh, no, no, I said I'd invite you to come with me to Stan Lee's.",0.0
1328,,Is there a new girlfriend in there?,1.0
1329,,I'm so glad you asked like that.,1.0
1330,,Perhaps something vaguely related to life as we know it on this planet?,1.0
1331,,"Excuse me, I'm thirsty, so I'm gonna go to the refrigerator and get me a refreshing drink.",0.0
1332,,"I've read an online study that works after a meal not only helps digestion, but increases serotonin, and you know me, if there's one thing I like more than a refreshing drink, it's serotonin.",0.0
1333,,"So what, you're just going up and down the stairs?",0.0
1334,,"That's very nice, but I'm gonna finish my coffee first.",0.0
1335,,"In 1917, when Albert Einstein established the theoretical foundation for laser in his paper <i>""Zur Quantentheorie der</i> <i>Strahlung,""</i> his most sincere hope was that the resulting device was bitchy.",1.0
1336,,"Leonard, may I introduce you, live from New Delhi, Dr. and Mrs. V. M. Koothrappali.",0.0
1337,,"A lot of people are working on this research, so what is it?",1.0
1338,,"I'm sorry, too, but there's no room for you in my wallet.",1.0
1339,,It's the kind of thing that makes it difficult to face him now.,0.0
1340,,He can buy his own office.,0.0
1341,,Is Bernadette talking about me?,0.0
1342,,"In the meantime, listen to this.",0.0
1343,,"He does it all the time, it's a cornucopia of social malfeasance.",0.0
1344,,"Actually, our rules are synchronized, Penny, Bernadette told me you were planning a girls' party.",0.0
1345,,"...so anyway, to make a long story short, it turns out that I have an exceptionally firm cervix.",0.0
1346,,"Bernadette dared to tell me a dirty story. Chaucer's ""The Miller's Tale"" is the filthiest story I know. It would have been hidden in sock drawers had the people of the 14th century worn socks.",0.0
1347,,Is it possible she's leaving for your cheek and you're moving and she accidentally had a lip?,0.0
1348,,I'm glad you finally got yourself a guard.,0.0
1349,,This woman looks exactly like the pictures of Princess Panchali in the book. How many times do you see a beloved fictional character materialize?,0.0
1350,,"Oh, and scientists want to talk about science with you.",1.0
1351,,"In the rooms of ten-year-old girls, where they belong.",1.0
1352,,"I don't know, someone bigger and... of course, why don't you?",1.0
1353,,"Obviously, we are no longer a League of Justice. We have no choice but to move on to our Muppet baby costumes.",0.0
1354,,"I understand, your loyalty is admirable, but if I were at the front?",0.0
1355,,"Of course. I'd like to raise two points. Number one, I think they <i>are talking about penis. And number two, these mimosas are kicking my little brown ass.",0.0
1356,,Maybe we're starting to zero on your problem.,1.0
1357,,You taught me something.,1.0
1358,,"Where are you going, Jack's drive-thru in the box?",1.0
1359,,Not to mention the fact that you'd have to turn off on Saturdays.,0.0
1360,,"There's always the possibility that a trash can will spontaneously form around the letter, but Occam's razor suggests that someone threw it out.",1.0
1361,,"Yeah, but you were asleep, because I didn't allow you to sleep.",0.0
