,Unnamed: 0,text,sarcasm
617,617.0,"So, what do you want to know?",0.0
618,618.0,All I see is a yellow smudge.,0.0
619,619.0,"Hmm, yeah, but somehow, you manage.",1.0
620,620.0,"Oh, the helmet will sense that and stop the experiment.",0.0
621,621.0,And it's gone.,0.0
622,622.0,Yeah. I already got a man for that.,1.0
623,623.0,"First of all, I've totally done karaoke with a rock star.",0.0
624,624.0,Did you know the Michael Myers mask from the film was actually a Captain Kirk mask turned inside out?,0.0
625,625.0,Says the man with a giant belt buckle and a dickey.,1.0
626,626.0,All the time? I only remember being invited to one.,0.0
627,627.0,Maybe he's cranky because he's off his bathroom schedule.,1.0
628,628.0,"You get that I'm wearing a corset because of you, not because I'm tired of breathing?",0.0
629,629.0,"Oh, come on. It was all in good fun.",0.0
630,630.0,Really? We're still doing this?,0.0
631,631.0,And I don't understand what's going on because I went to MIT.,1.0
632,632.0,It was. And I'm sorry about earlier.,0.0
633,633.0,"Hmm. Look at you, improving on perfection. How so?",1.0
634,634.0,"What do you want, Sheldon?",0.0
635,635.0,That's what you said about the butterfly pavilion at the zoo.,1.0
636,636.0,"I'm gonna hook up the garden hose, so it has running water.",0.0
637,637.0,You sound like my wife just before she asked me to go to Coachella.,1.0
638,638.0,a little swagger in your step?,0.0
639,639.0,"Should we form a line, or just do it like we're bobbing for apples?",1.0
640,640.0,"Hmm. But you're not, are you?",0.0
641,641.0,"You know, if it's that easy, then why does Leonard have to drive you to work every day?",0.0
642,642.0,"Yeah, sure. You slept with your husband.",0.0
643,643.0,(whining): It's just so hard!,0.0
644,644.0,What was the case?,0.0
645,645.0,I have no idea.,0.0
646,646.0,"Well, how would you guys feel about going to India for my wedding?",0.0
647,647.0,"Yeah. And my mom loves Penny, which is weird, because I never knew she could love.",1.0
648,648.0,It doesn't have to be tonight.,0.0
649,649.0,"Yeah, you're gonna need to show your work on that.",1.0
650,650.0,Which is perfect.,1.0
651,651.0,"He's our friend. What's up, pal?",0.0
652,652.0,You can do that but you still can't get my bra off.,1.0
653,653.0,(chuckles) Couldn't think of a single reason not to.,1.0
654,654.0,"How about that? There is an ""I"" in ""team.""",1.0
655,655.0,"Well, I am shocked, Sheldon, because I totally believed that the woman you reported for being stingy with the peas couldn't keep her hands off you.",1.0
656,656.0,You mean the last two minutes or the last 20 years?,1.0
657,657.0,It just got more fun.,1.0
658,658.0,"All right, great, can we go?",0.0
659,659.0,Okay.,0.0
660,660.0,"What, the alphabet?",1.0
661,661.0,"All right, well, they're already dead. There's nothing we can do.",1.0
662,662.0,Like I don't care at all.,0.0
663,663.0,You or the steak?,0.0
664,664.0,Why is it all in the living room?,0.0
665,665.0,"And when I was little and my dog died, my mom sat me down and very gently told me that she wished the truck had hit my dad instead.",1.0
666,666.0,- A waste of champagne?,1.0
667,667.0,"No offense, worker bees.",1.0
668,668.0,"Well, you really managed to capture my voice.",1.0
669,669.0,"""Pretty well""?",1.0
670,670.0,Maybe she doesn't have tip money?,1.0
671,671.0,"Yeah, so impressive how you manage to bounce back after having no babies.",1.0
672,672.0,"I open the door and say, ""Hey, Raj.""",1.0
673,673.0,Leonard was just saying how he was hoping to have dinner with one of your ex-boyfriends on his expensive boat.,1.0
674,674.0,You went to college.,1.0
675,675.0,but... thank you for saying it out loud.,1.0
676,676.0,They wanted you?,1.0
677,677.0,"Well, I know how to do the dishes. Just, sometimes I'm tired.",1.0
678,678.0," Yeah, who remembers the guy who was trying to find India and discovered America instead?",1.0
679,679.0,"including the rare ""DayQuilt"" misprint from 1996.",1.0
680,680.0,It's nice they found each other.,1.0
681,681.0,"Yeah, and we don't find it weird at all.",1.0
682,682.0,"Oh, yeah, I would have forgotten, except for those nonrefundable airline tickets to India I bought.",1.0
683,683.0,"Well, it is important for you two to keep the spark alive.",1.0
684,684.0,"I told you, if we left pizza on the counter,",1.0
685,685.0,"Well, I took a nap next to Hot Dog on a Stick. What do you think?",1.0
686,686.0,"Really? Well, I did not see that coming.",1.0
687,687.0,"Oh, no, this is the rest of our lives.",1.0
688,688.0,Was one of the options the option to never come back?,1.0
689,689.0,"What do you call that, Bishops Be Crazy?",1.0
690,690.0,Maybe she's basing that on your poor husbanding skills.,1.0
691,691.0,"No, by opening the door to a hangar and letting the airplane fly in.",1.0
692,692.0,"Yeah, you should've seen her take down John Krasinski last week. Got him to admit he loved his wife. It was brutal.",1.0
693,693.0,"Honey, remember, she's my child, too.",1.0
694,694.0,"And I'm supposed to be living on my own at this age, but here we are.",1.0
695,695.0,"No. ""Unfortunately, Sheldon..."" that's all you got to say.",1.0
696,696.0,But the time machine thing is probably more likely.,1.0
697,697.0,No. (chuckles) It's great. I just don't want anyone to ever see it or read it or know it exists.,1.0
698,698.0,Numb your brain with alcohol and watch a reality show where wealthy people pick fake arguments with each other?,1.0
699,699.0,"Well, I don't see what else you could've done.",1.0
700,700.0,I speak a little Russian. Will you take nyet for an answer?,1.0
701,701.0,"Yes, but it may just be the Indian accent.",1.0
702,702.0,Other than Bernadette? That does not sound right.,1.0
703,703.0,You sure you're not thinking about your husband?,1.0
704,704.0,Never? Isn't that usually when you go to the gym?,1.0
705,705.0,"Apparently, a guy who wants to have his feelings hurt.",1.0
706,706.0,"I can see why she would say that, but why do you?",1.0
707,707.0,"So, you're an Indian giver?",1.0
708,708.0,So not Mr. and Mrs. Wackadoodle?,1.0
709,709.0,maybe 300 tiny haircuts over a ten-year period.,1.0
710,710.0,"Heck, you've had sex almost as many times as I have fingers.",1.0
711,711.0,"This might be the glue talking, but that was a very pleasurable 139 and a half hours.",1.0
712,712.0,I stand by my statement.,1.0
713,713.0,"It was her, right?",1.0
714,714.0,Welcome to my life.,1.0
715,715.0,(quietly): I told you these tickets weren't free.,1.0
716,716.0,"Yes you can. You're thinking about time, you can't go back in time.",0.0
717,717.0,No Blanche she is upset because they keep changing the taste of coke.,1.0
718,718.0,"No, this is just part of a daredevil game that I play called wait until last moment before I burst and die",1.0
719,719.0,Was that place the sun?,1.0
720,720.0,Why? You never look down in the shower?  Oh please I am allowed one joke in the monkey is penis genre.,1.0
721,721.0,You'd better act surprised.,0.0
722,722.0,"I thought if I littered, that crying Indian might come by and save us.",1.0
723,723.0,His cappucino maker.,1.0
724,724.0,What was that?!,0.0
725,725.0,I think this is probably why Damone smokes in his cell alone.,1.0
726,726.0,"No, no the actual cartoon character .. Of course the baloon.",1.0
727,727.0,Spanish midgets wrestling Julie! Okay yes I see how they got there.,1.0
728,728.0,"I am sorry, we donÃ•t have your sheep.",1.0
729,729.0,"Seriously, it's moving!",0.0
730,730.0,Yeah. What-what should I do?,0.0
731,731.0,I studied for a year in Barcelona.,0.0
732,732.0,"You know some might find it amusing, I myself find it regular.",1.0
733,733.0,What was I doing? My ben gazara in person?,1.0
734,734.0,Nooo!,1.0
735,735.0,I am so confused as to what we have been doing so far.,1.0
736,736.0,I mean if you hadn't initiated it I-I-I know I would've.,0.0
737,737.0,No I am upset because Joe Piscapo didn't get the lead role in rain man.,1.0
738,738.0,"When? Today? Some, not a lot.",0.0
739,739.0,You building a post office?,1.0
740,740.0,What are these? Claws?,1.0
741,741.0,"All right, let's do it.",0.0
742,742.0,I really don't wanna sit with Allen Iverson over there .,0.0
743,743.0,Paper cut!,0.0
744,744.0,"No, she I supset because Jimmy Swaager can't cover his motel bill",1.0
745,745.0,"Okay, but If he asks, I am not going to lie.",0.0
746,746.0,Sarcastic? Us? Nooo.,1.0
747,747.0,We think it was trying to spell out monkey.,1.0
748,748.0,Lords of Arabia,1.0
749,749.0,"So Ross, how umm, how did it go with Bonnie?",0.0
750,750.0,"Well, we're trying to find someone to perform our wedding and they're all either boring or annoying or y'know, can't stop staring at the ladies.",0.0
751,751.0,"Hey, that's Joincidence with a C",1.0
752,752.0,Thank you.,0.0
753,753.0,I'm sorry man there is never a good time to have to .. Stop catching on fire.,1.0
754,754.0,"Take your shirt off, and let's see what we're dealing with here.  What are you doing?",0.0
755,755.0,"Yeah, I mean, it would be rude to them for us to leave now.",1.0
756,756.0,Your makeup?,1.0
757,757.0,"Okay, does this look like a garbage can to you?",0.0
758,758.0,Great! Now we can do laundry all night. All night laundry!,1.0
759,759.0,A bucket of chicked. I hope you like it extra flat and crispy,1.0
760,760.0,"Because his penis was too big. I am sorry, thatÃ•s the kind of thing I do.",0.0
761,761.0,I can see it from right here. It'll cost you one husband.,1.0
762,762.0,"Ow, ow, ow, ow, leg cramp, leg cramp, leg cramp.",0.0
763,763.0,"Oh boy, I just can't watch. It's too scary!",1.0
764,764.0,But I'm the host!,0.0
765,765.0,Did I wake you?,1.0
766,766.0,"Hes not right for the part, and if I suggest him my bosses are going to think I am an idiot. And thatÃ•s something they should learn on their own.",1.0
767,767.0,The British are coming?,1.0
768,768.0,What is the matter with your face?!,0.0
769,769.0,The whole thing! Can we go?,1.0
770,770.0,We- we had our first fight this morning.,0.0
771,771.0,Oh! Satan's minions at work again?,1.0
772,772.0,I'm the ruptured spleen.,0.0
773,773.0,I can show you an ID if you want?,1.0
774,774.0,"This is so good, that I am gonna enjoy it in the balcony. I can enjoy my view, whilst I enjoy my desert.",1.0
775,775.0,That oughta do it.,0.0
776,776.0,Yeah! Look!,0.0
777,777.0,The liberarche marquee at Caesar's palace,1.0
778,778.0,"No, rabies.",1.0
779,779.0,"Excellent hole, Joe.",1.0
780,780.0,That's so funny because you look more like Joey Tribbiani man slash woman.,1.0
781,781.0,You had no relationship!!,0.0
782,782.0,"Yeah okay, I was just talking to the guys. Just look at them I mean, is it okay if they come visit?",1.0
783,783.0,Well scott I am sure we are all really really looking forward to hear your story.,1.0
784,784.0,"So, you're just Bing?",0.0
785,785.0,"Yeah, a slice of cheesecake and-and a date if you're given'  'em out.",0.0
786,786.0,"And it came out, ""Squatternut buash?""",0.0
787,787.0,What?,0.0
788,788.0,Ah your own brand of vigilante justice.,1.0
789,789.0,"Yeah, she's fired.",0.0
790,790.0,"ThatÃ•s a good one too Pheebs, now all that I have to do is find a plane load of people whose resolution is to plummet to their deaths",1.0
791,791.0,My duties?  All right.,0.0
792,792.0,Yeah?,0.0
793,793.0,It's not funny!,0.0
794,794.0,"Oh Oh, I am convinced!",1.0
795,795.0,"I did not mean to touch that,I mean",0.0
796,796.0,A tshirt that says - I don't belong here.,1.0
797,797.0,It's that whole sensitive thing.,0.0
798,798.0,Really?,1.0
799,799.0,When are you coming home?,0.0
800,800.0,"Wait, wait, Chandler, this is what you're havin' for Thanksgiving dinner?",0.0
801,801.0,Ohhh!!!!,0.0
802,802.0,"Hey, does somebody wanna hand me one of those tiles.",0.0
803,803.0,See Joe that's why your parents told you not to jump on your bed!,0.0
804,804.0,"The little man who lives in there, who turns the light on and off will tell you.",1.0
805,805.0,"I guess he wants to do a little dance, you know, make a little love. Well pretty much get down to that.",1.0
806,806.0,"I don't know, something girlie.",0.0
807,807.0,"These people find out that a spelling game is going over there, there will be nobody left at our party.",1.0
808,808.0,You sure he is going to be able to crack that code?,1.0
809,809.0,Then we went to this bar and he hooked us up with all these women!,0.0
810,810.0,"Okay, Janice. Janice. You gotta give me Janice. That wasn't about being picky.",0.0
811,811.0,"No, no, no, it's flattery.",0.0
812,812.0,"Well, umm, my Mom's friend, Phoebe, is actually my birth Mom.",0.0
813,813.0,"See, there you go, the cleansing works!",0.0
814,814.0,You can't make this stuff up!,0.0
815,815.0,"Gee, if only she were one and had no idea what a birthday was.",1.0
816,816.0,"Uh, okay. The fifth dentist caved and now they're all recommending Trident?",1.0
817,817.0,No!,0.0
818,818.0,"Oh I do. Oh no, wait a minute, I took it out of my shirt when I put it on this morning.",1.0
819,819.0,Are you still enjoying your nap?,1.0
820,820.0,"Look I never should have kissed your girlfriend, but I'm",0.0
821,821.0,"Well ah, I've been doing a lot of thinking, and I look at my life",0.0
822,822.0,"Well, it will probably slow me down at first. But once I am used to the extra weight, I ll get back on track.",1.0
823,823.0,Uh yes! Thank you.,1.0
824,824.0,"I mean, you and I we're just, y'know, we're nothing, we're goofin' around.",1.0
825,825.0,"Oh, you say someone's name enough, they turn around.",1.0
826,826.0,No!! You have been screwing us all day!,0.0
827,827.0,Yeah!,0.0
828,828.0,"Yeah. Yeah, that's what you need a good .. pill.",1.0
829,829.0,It's a musical Rose,1.0
830,830.0,"Oh, hey, look, I found coffee! Okay, let's skedaddle.",0.0
831,831.0,"I am telling you, when she leaned back, I could see her brain",1.0
832,832.0,"I wasn't by myself. I had a doctor, a nurse, and a helper guy. So, did you see who won the game?",0.0
833,833.0,"Okay, are you aware unagi  is an eel?",1.0
834,834.0,"Oh, no, no. I just meant hypothetically.",0.0
835,835.0,Wow! Imagine what our kids would look like!,0.0
836,836.0,Okay?,0.0
837,837.0,Really!?,0.0
838,838.0,"A lonely grey couch. "" O look "" cried Ned. And then the kingdom was his. The End.",0.0
839,839.0,"No no, you don't have to fly back, really.",0.0
840,840.0,Hey.,0.0
841,841.0,Sarcasm? Noo.,1.0
842,842.0,WeÄâ‚¬â„¢re not peeking?,0.0
843,843.0,: Yeah.,0.0
844,844.0,Sounds like she has got the whole package!,1.0
845,845.0,"Carol called me to thank me for the lasagna, I asked, she told me.",0.0
846,846.0,"Joey ate my last stick of gum, so I killed him. Do you think that was wrong?",1.0
847,847.0,"Ofcourse no Ma, I am referring to Carrey Grant, he is living in the broom closet.",1.0
848,848.0,What-wh-what so we'll just stay married forever?,1.0
849,849.0,Dee. The sarcastic sister from What's Happening.,1.0
850,850.0,What?  Why?,0.0
851,851.0,"And sometimes I would want you to steal third, and I'll go like this.",1.0
852,852.0,"Oh I am sorry, do you need a break?",1.0
853,853.0,Maybe he was nervous.,1.0
854,854.0,"Nooo! No, that's not true. No, best time ever! Yeah, you rocked my world!",1.0
855,855.0,It was like months ago.,0.0
856,856.0,"Umm, would you please excuse me for a moment?",0.0
857,857.0,"No, she is going to sit here where itÃ•s a 112 degrees and eat enchiladas.",1.0
858,858.0,No,0.0
859,859.0,"Oh, um, I don't care!",1.0
860,860.0,Nobody sees the king!,0.0
861,861.0,"I am sorry, it was a one time thing. I was very drunk and it was someone else's subconscious",1.0
862,862.0,What would you give to a kid if he wanted a ticket to play with?,0.0
863,863.0,And I think my testicles may be in here too,1.0
864,864.0,So how'd it go?,0.0
865,865.0,I don't think you could ever do that.,0.0
866,866.0,"Hey, do you know a six-letter word for red?",0.0
867,867.0,I know but it's so hard! Nothing rhymes with your stupid name!,0.0
868,868.0,No thanks Josephine!,1.0
869,869.0,Take a couple deep breaths.,0.0
870,870.0,"No, no no, I just mediate the gorup. I just give up every Tuesday of my life to help these screwups for the good of my health",1.0
871,871.0,"Even if people are on it!""",1.0
872,872.0,Well thank God your livelihood doesn't depend on it.,1.0
873,873.0,Sarcasm? At a sarcasmoholics meeting?,1.0
874,874.0,"Oh sure, go with the sissy.",1.0
875,875.0,Am I out of control?,0.0
876,876.0,"I guess you'd know that, being one of the two of us, though, right?",1.0
877,877.0,"Yeah, I'm fine.",0.0
878,878.0,"Ah, oh, hang on a second. Come in, come in. All right, so think about it, and call me back.",0.0
879,879.0,Was it not pain-free?,1.0
880,880.0,No.,0.0
881,881.0,"Hey, my father's house does that.",0.0
882,882.0,That monkey has got a Ross on its ass!,1.0
883,883.0,Stick to the list.,0.0
884,884.0,"This-this, no, oh no, no-no-no, this is not,that's-that's not what it is.",0.0
885,885.0,"When they're hungry enough, they'll come in.",0.0
886,886.0,"Uh, listen, I need that broiling pan that Joey borrowed the other day.",0.0
887,887.0,And I am sure every person here really really wants you to join our group.,1.0
888,888.0,Thank you.,0.0
889,889.0,Is it me or the greetings gone downhill around here?,1.0
890,890.0,Oh! Oop!,0.0
891,891.0,"Well, I'd gotten Judy pregnant. I still don't know how that happened.",1.0
892,892.0,"In what Blanche, dog years?",1.0
893,893.0,"So to sum up, I'm Professor Geller.",0.0
894,894.0,A hand puppet Rose.,1.0
895,895.0,Oh I left them in my bulldozer .. I don't have tools!,1.0
896,896.0,Well what are you gonna do when he finds out he wasn't even asked?!,0.0
897,897.0,Oh no donÃ•t go. I have scared you. I have said too much. I am hopeless and awkward and desperate for love.,0.0
898,898.0,"No Rose, I am nervous because Sonny Bono gets elected mayor of Palm Springs, he is gonna make all the postmens wear leather bell bottoms and a fur vest.",1.0
899,899.0,"No Rose, she is depressed because Marvel had manners on only once a week",1.0
900,900.0,"No Rose, it stands alone.",1.0
901,901.0,"Nothing. It's just old and dingy, that's all.",0.0
902,902.0,Yeah.,0.0
903,903.0,"Stating the obvious, but thank you. And it's not weird is it.",1.0
904,904.0,"I do not always have to be,okay, okay.",0.0
905,905.0,"You know once you are inside, you don't have to knock anymore.",1.0
906,906.0,"The big deal is I don't want naked, greasy strangers in my apartment when I want to kick back with a puzzle,beer! Cold beer.",0.0
907,907.0,Nooo,1.0
908,908.0,"Nope. Op, wait! There he goes.",0.0
909,909.0,"Well, don't  'cha wanna?",0.0
910,910.0,"I just have to do one thing, really quickly, its not a big thing  ...  GET UP||",1.0
911,911.0,You have to stop the Q-Tip when there is resistance,1.0
912,912.0,I-I'm really sorry. It's just that I,0.0
913,913.0,Actually I yesterday I was smoking again. Today I am smoking still.,1.0
914,914.0,I was making a coconut phone with a professor.,1.0
915,915.0,Janice? Janice?,1.0
916,916.0,I was thkinking about maybe going into the Robot.,0.0
917,917.0,Me? I am gonna die alone!,1.0
918,918.0,Yeah either that or gloria estefan was right eventually the rhythm is going to get you,1.0
919,919.0,"No Blanche, with a venus fly trap",1.0
920,920.0,It's not a real game! I made it up!,0.0
921,921.0,Oh just like give a minute to wake up for this  ...  Ha ha! You lost the ring. You are the worst best man ever!,0.0
922,922.0,Noo..,1.0
923,923.0,"No, I know, but I,he just went on.",0.0
924,924.0,"Yes, I know, but her friend sounds like such a...",0.0
925,925.0,"Yeah, she couldn't live without the Chan Love.",0.0
926,926.0,Huh! Whats dufus speled backwards?,1.0
927,927.0,"Oh hurry up, I want to sign that.",1.0
928,928.0,"No, I am depressed becaues Phillis George left the morning news.",1.0
929,929.0,Ah you see perfect might be a problem. Had you said co-dependent or self-destructive.,1.0
930,930.0,Pheebs?,0.0
931,931.0,You still love me?,0.0
932,932.0,"Rose, you should sit here and watch her hack herself to death",1.0
933,933.0,"Anyway, I should go, one of the lifeguards was just about to dismantle a nuclear device.",0.0
934,934.0,I'm supposed to teach a graduate seminar there in ten minutes.,0.0
935,935.0,For what? For letting you throw me out of your office?,1.0
936,936.0,Hey!,0.0
937,937.0,"Okay, but if you are not coming back soon, there is pretty much nothing I can do about it",1.0
938,938.0,I'll catch you guys later.,0.0
939,939.0,If you wanna put a label on it.,1.0
940,940.0,Some guy bought it. I'm sorry. I tired to stop it but they put me in jail!,0.0
941,941.0,"Chloe, switch with me, there's some guys here that got a crush on you.",0.0
942,942.0,Were you so late because you were burying this woman?,1.0
943,943.0,Uh-huh!,0.0
944,944.0,"Look, please, please don't go anywhere, okay?",0.0
945,945.0,"No you are not Chandler, we still love you Chandler",1.0
946,946.0,Joey's got a really bad hernia but its nothing that a laser eye surgery wont fix,1.0
947,947.0,"Well, I like it. Here you go.",0.0
948,948.0,Like I have nothing better to do!,1.0
949,949.0,And did he?,0.0
950,950.0,"Are you kidding? I love that guy!  Morning's here! Morning is here,",0.0
951,951.0,"Oh-oh, that's a risky little game!",0.0
952,952.0,His legs flail about as if independent from his body,0.0
953,953.0,"I really, really enjoyed it. Very exotic.",1.0
954,954.0,"Well, y'know I'm 29. I mean who needs a savings account.",1.0
955,955.0,I guess you would know that or else we would be in a predicament room,1.0
956,956.0,I'm never gonna get to meet her anyway.,0.0
957,957.0,I was saying the actual words,1.0
958,958.0,We can? Ok I am trying that.,1.0
959,959.0,"Me too! There's a game on Tuesday, do you wanna go?",0.0
960,960.0,"Oh yeah. First off all, chasing the Churo guy isn't jogging.",0.0
961,961.0,Really? Struck down in the prime of life.,1.0
962,962.0,"Twenty-one hours, you're a hero.",0.0
963,963.0,"Whoa, maybe I was!",0.0
964,964.0,"No its not big, not at all. Kind of the same lines as, I don't know, having a third nipple!",1.0
965,965.0,"He's right, even if it's to say something complementary.",0.0
966,966.0,No itÃ•s the rose in the kitchen thing.,1.0
967,967.0,"Dear god, this parachute is a knapsack",1.0
968,968.0,"Ross-Ross, you have no idea what this means to me!",0.0
969,969.0,Okay?,0.0
970,970.0,"I'd love to show ya, but I just tucked her in.",0.0
971,971.0,It was an accident. Not like I was across the street with a telescope and a box of donuts.,1.0
972,972.0,Do you still wanna call  'em? I wanna call  'em.,0.0
973,973.0,"Oh no, now its not gonna make any sense",1.0
974,974.0,"Oh ma no, it was a little girl selling girl scout toilets.",1.0
975,975.0,If only there was something in your head to control the things you say.,1.0
976,976.0,"Ross umm, there's something that I've got to tell you, there's-there's someone else.",0.0
977,977.0,And you are gonna make them all disappear.,1.0
978,978.0,"Yes, we all know how cruel a parent can be, about the flatness of a child's pillow.",1.0
979,979.0,What are you up too?,0.0
980,980.0,"Wow you look just like your son, Mrs. Tribbiani",1.0
981,981.0,"No Rose, at a pie eating contest.",1.0
982,982.0,Ok!,0.0
983,983.0,"Oh, uh, no thanks. I just had an M&M.",1.0
984,984.0,"No Rose, that you should do.",1.0
985,985.0,That is the coast guard!,0.0
986,986.0,Amazing.,1.0
987,987.0,And I just won a million dollars!,0.0
988,988.0,I'm the supply manager.,0.0
989,989.0,Lovely,1.0
990,990.0,"Oh yeah ok, including the waffles last week, you now owe me, seventeen zillion dollars.",1.0
991,991.0,"And then and then you clicked it again, she's dressed. She is a business woman, she is walking down the street and oh oh oh she's naked.",0.0
992,992.0,"Oh, wait a minute, I have no one.",1.0
993,993.0,No I am worried she might be Phir Resuda's,1.0
994,994.0,"Thanks, but I kinda have a problem to deal with here.",0.0
995,995.0,All right.,0.0
996,996.0,"Y'know you, you just stop being such a wuss and get those off and you come with us and watch naked girls dance around!!",0.0
997,997.0,Yes yes it is! In Prison!!,1.0
998,998.0,You got off to a really good start with the group.,1.0
999,999.0,"Anyway, they want to take us out Saturday night! What do you say?",0.0
1000,1000.0,"And Hornswoggle? What? Are you dating a character from ""Fraggle Rock""? Ahh.",1.0
1001,1001.0,"Just a sec, give me a minute to wake up for this,Ah-ha-ha!!",0.0
1002,1002.0,"No, its because I cannot make any sense of those commercials for obsession.",1.0
1003,1003.0,We got a box.,0.0
1004,1004.0,"Maybe it's a contest, you know? Like ""Collect all five"".",1.0
1005,1005.0,"Let me think! Let me think! Oh, I don't care.",1.0
1006,1006.0,"I'm sorry Sophia, but in Dorothy's defence, it sure sounds a lot like her.",1.0
1007,1007.0,Did you tell her about the magical night that starts with the flush of every toilet?,1.0
1008,1008.0,But younger than some buildings!,1.0
1009,1009.0,"Okay, you guys, just relax.  I doooo.",0.0
1010,1010.0,"Uh, so how many cameras are actually on you.",1.0
1011,1011.0,The end.,0.0
1012,1012.0,"Nope, that patch is no good.",1.0
1013,1013.0,Oh my God I love that! - Really? - NO!,1.0
1014,1014.0,I'm worried about whether Michael Jackson will be able to buy the remains of the elephant man.,1.0
1015,1015.0,"All right, okay, well, apparently not!",1.0
1016,1016.0,To feed the cat Rose.,1.0
1017,1017.0,"Oh my God!! Ohh, that is it! I'm leaving! You are just a horrible person!",0.0
1018,1018.0,"No, I haven't taken her out of the trunk of the car yet.",1.0
1019,1019.0,"Yes, the doctor's say if they remove it, he will die!",1.0
1020,1020.0,Crazy bitch!,1.0
1021,1021.0,"Well, I believe the piece of furniture was fine until your little breakfast adventure with Angela Delvecchio",0.0
1022,1022.0,"You said you spent all that money because those boots go with skirts, dresses and pants. What do you plan on wearing? A Chicken suit?",1.0
1023,1023.0,Because it wears a little sunbrella Rose.,1.0
1024,1024.0,What's going on?!  That's what's going on!!,0.0
